Unnamed: 0,book_id,title,year,pages,description,genres,average_rating,ratings_count,books_count,authors
0,1,"The Hunger Games (The Hunger Games, #1)",2008,374,winning means fame and fortunelosing means certain deaththe hunger games have begun   in the ruins of a place once known as north america lies the nation of panem a shining capitol surrounded by twelve outlying districts the capitol is harsh and cruel and keeps the districts in line by forcing them all to send one boy and once girl between the ages of twelve and eighteen to participate in the annual hunger games a fight to the death on live tvsixteenyearold katniss everdeen regards it as a death sentence when she steps forward to take her sisters place in the games but katniss has been close to dead beforeand survival for her is second nature without really meaning to she becomes a contender but if she is to win she will have to start making choices that weight survival against humanity and life against love,"youngadult, fiction, fantasy, sciencefiction, romance",4.34,4780653,272,Suzanne Collins
1,2,"Harry Potter and the Sorcerer's Stone (Harry Potter, #1)",1997,309,harry potters life is miserable his parents are dead and hes stuck with his heartless relatives who force him to live in a tiny closet under the stairs but his fortune changes when he receives a letter that tells him the truth about himself hes a wizard a mysterious visitor rescues him from his relatives and takes him to his new home hogwarts school of witchcraft and wizardryafter a lifetime of bottling up his magical powers harry finally feels like a normal kid but even within the wizarding community he is special he is the boy who lived the only person to have ever survived a killing curse inflicted by the evil lord voldemort who launched a brutal takeover of the wizarding world only to vanish after failing to kill harrythough harrys first year at hogwarts is the best of his life not everything is perfect there is a dangerous secret object hidden within the castle walls and harry believes its his responsibility to prevent it from falling into evil hands but doing so will bring him into contact with forces more terrifying than he ever could have imaginedfull of sympathetic characters wildly imaginative situations and countless exciting details the first installment in the series assembles an unforgettable magical world and sets the stage for many highstakes adventures to come,"fantasy, fiction, youngadult, classics",4.44,4602479,491,J.K. Rowling
3,4,To Kill a Mockingbird,1960,324,the unforgettable novel of a childhood in a sleepy southern town and the crisis of conscience that rocked it to kill a mockingbird became both an instant bestseller and a critical success when it was first published in 1960 it went on to win the pulitzer prize in 1961 and was later made into an academy awardwinning film also a classiccompassionate dramatic and deeply moving to kill a mockingbird takes readers to the roots of human behavior  to innocence and experience kindness and cruelty love and hatred humor and pathos now with over 18 million copies in print and translated into forty languages this regional story by a young alabama woman claims universal appeal harper lee always considered her book to be a simple love story today it is regarded as a masterpiece of american literature,"classics, fiction, historicalfiction, youngadult",4.25,3198671,487,Harper Lee
5,6,The Fault in Our Stars,2012,313,despite the tumorshrinking medical miracle that has bought her a few years hazel has never been anything but terminal her final chapter inscribed upon diagnosis but when a gorgeous plot twist named augustus waters suddenly appears at cancer kid support group hazels story is about to be completely rewritteninsightful bold irreverent and raw the fault in our stars is awardwinning author john greens most ambitious and heartbreaking work yet brilliantly exploring the funny thrilling and tragic business of being alive and in love,"youngadult, romance, fiction, contemporary",4.26,2346404,226,John Green
6,7,The Hobbit,1937,366,in a hole in the ground there lived a hobbit not a nasty dirty wet hole filled with the ends of worms and an oozy smell nor yet a dry bare sandy hole with nothing in it to sit down on or to eat it was a hobbithole and that means comfortwritten for jrr tolkien’s own children the hobbit met with instant critical acclaim when it was first published in 1937 now recognized as a timeless classic this introduction to the hobbit bilbo baggins the wizard gandalf gollum and the spectacular world of middleearth recounts of the adventures of a reluctant hero a powerful and dangerous ring and the cruel dragon smaug the magnificent the text in this 372page paperback edition is based on that first published in great britain by collins modern classics 1998 and includes a note on the text by douglas a anderson 2001,"fantasy, classics, fiction, youngadult",4.25,2071616,969,J.R.R. Tolkien
9,10,Pride and Prejudice,1813,279,alternate cover edition of isbn since its immediate success in 1813 pride and prejudice has remained one of the most popular novels in the english language jane austen called this brilliant work her own darling child and its vivacious heroine elizabeth bennet as delightful a creature as ever appeared in print the romantic clash between the opinionated elizabeth and her proud beau mr darcy is a splendid performance of civilized sparring and jane austens radiant wit sparkles as her characters dance a delicate quadrille of flirtation and intrigue making this book the most superb comedy of manners of regency england,"classics, fiction, romance, historicalfiction",4.24,2035490,3455,Jane Austen
10,11,The Kite Runner,2003,371,the unforgettable heartbreaking story of the unlikely friendship between a wealthy boy and the son of his father’s servant the kite runner is a beautifully crafted novel set in a country that is in the process of being destroyed it is about the power of reading the price of betrayal and the possibility of redemption; and an exploration of the power of fathers over sonstheir love their sacrifices their liesa sweeping story of family love and friendship told against the devastating backdrop of the history of afghanistan over the last thirty years the kite runner is an unusual and powerful novel that has become a beloved oneofakind classickhaledhosseinicom,"fiction, historicalfiction, contemporary, classics",4.26,1813044,283,Khaled Hosseini
11,12,"Divergent (Divergent, #1)",2011,487,in beatrice priors dystopian chicago world society is divided into five factions each dedicated to the cultivation of a particular virtuecandor the honest abnegation the selfless dauntless the brave amity the peaceful and erudite the intelligent on an appointed day of every year all sixteenyearolds must select the faction to which they will devote the rest of their lives for beatrice the decision is between staying with her family and being who she really isshe cant have both so she makes a choice that surprises everyone including herselfduring the highly competitive initiation that follows beatrice renames herself tris and struggles alongside her fellow initiates to live out the choice they have made together they must undergo extreme physical tests of endurance and intense psychological simulations some with devastating consequences as initiation transforms them all tris must determine who her friends really areand where exactly a romance with a sometimes fascinating sometimes exasperating boy fits into the life shes chosen but tris also has a secret one shes kept hidden from everyone because shes been warned it can mean death and as she discovers unrest and growing conflict that threaten to unravel her seemingly perfect society she also learns that her secret might help her save those she loves    or it might destroy her,"youngadult, fiction, fantasy, sciencefiction, romance",4.24,1903563,210,Veronica Roth
12,15,The Diary of a Young Girl,1947,283,discovered in the attic in which she spent the last years of her life anne frank’s remarkable diary has become a world classica powerful reminder of the horrors of war and an eloquent testament to the human spirit in 1942 with the nazis occupying holland a thirteenyearold jewish girl and her family fled their home in amsterdam and went into hiding for the next two years until their whereabouts were betrayed to the gestapo the franks and another family lived cloistered in the “secret annexe” of an old office building cut off from the outside world they faced hunger boredom the constant cruelties of living in confined quarters and the everpresent threat of discovery and death in her diary anne frank recorded vivid impressions of her experiences during this period by turns thoughtful moving and surprisingly humorous her account offers a fascinating commentary on human courage and frailty and a compelling selfportrait of a sensitive and spirited young woman whose promise was tragically cut shortback cover,"nonfiction, classics, history, biography, memoir",4.1,1972666,710,Anne Frank
13,16,"The Girl with the Dragon Tattoo (Millennium, #1)",2005,465,harriet vanger a scion of one of sweden’s wealthiest families disappeared over forty years ago all these years later her aged uncle continues to seek the truth he hires mikael blomkvist a crusading journalist recently trapped by a libel conviction to investigate he is aided by the pierced and tattooed punk prodigy lisbeth salander together they tap into a vein of unfathomable iniquity and astonishing corruptionan international publishing sensation stieg larsson’s the girl with the dragon tattoo combines murder mystery family saga love story and financial intrigue into one satisfyingly complex and entertainingly atmospheric novelalternate cover edition isbn  isbn13 ,"fiction, mystery, suspense, contemporary, thriller, crime",4.11,1808403,274,Stieg Larsson
14,17,"Catching Fire (The Hunger Games, #2)",2009,391,sparks are ignitingflames are spreadingand the capital wants revengeagainst all odds katniss everdeen has survived the hunger games she and fellow district 12 tribute peeta mellark are miraculously still alive katniss should be relieved happy even yet nothing is the way katniss wishes it to be gale holds her at an icy distance peeta has turned his back on her completely and there are whispers of a rebellion against the capitol  a rebellion that katniss and peeta may have helped createmuch to her shock katniss has fueled an unrest that shes afraid she cannot stop and what scares her even more is that shes not entirely convinced she should try as time draws near for katniss and peeta to visit the districts on the capitols cruel victory tour the stakes are higher than ever if they cant prove without a shadow of a doubt that they are lost in their love for each other the consequences will be horrifying katniss is about to be tested as never before,"youngadult, fiction, fantasy, sciencefiction, romance",4.3,1831039,201,Suzanne Collins
15,18,"Harry Potter and the Prisoner of Azkaban (Harry Potter, #3)",1999,435,harry potters third year at hogwarts is full of new dangers a convicted murderer sirius black has broken out of azkaban prison and it seems hes after harry now hogwarts is being patrolled by the dementors the azkaban guards who are hunting sirius but harry cant imagine that sirius or for that matter the evil lord voldemort could be more frightening than the dementors themselves who have the terrible power to fill anyone they come across with aching loneliness and despair meanwhile life continues as usual at hogwarts a topoftheline broom takes harrys success at quidditch the sport of the wizarding world to new heights a cute fourthyear student catches his eye and he becomes close with the new defense of the dark arts teacher who was a childhood friend of his father yet despite the relative safety of life at hogwarts and the best efforts of the dementors the threat of sirius black grows ever closer but if harry has learned anything from his education in wizardry it is that things are often not what they seem tragic revelations heartwarming surprises and highstakes magical adventures await the boy wizard in this funny and poignant third installment of the beloved seriesscholasticcom,"fantasy, youngadult, fiction, classics",4.53,1832823,376,J.K. Rowling
16,20,"Mockingjay (The Hunger Games, #3)",2010,390,the final book in the groundbreaking hunger games trilogy this new foiled edition of mockingjay is available for a limited period of time against all odds katniss everdeen has survived the hunger games twice but now that shes made it out of the bloody arena alive shes still not safe the capitol is angry the capitol wants revenge who do they think should pay for the unrest? katniss and whats worse president snow has made it clear that no one else is safe either not katnisss family not her friends not the people of district 12,"youngadult, fiction, fantasy, sciencefiction, romance",4.03,1719760,239,Suzanne Collins
17,21,"Harry Potter and the Order of the Phoenix (Harry Potter, #5)",2003,870,there is a door at the end of a silent corridor and it’s haunting harry pottter’s dreams why else would he be waking in the middle of the night screaming in terror?harry has a lot on his mind for this his fifth year at hogwarts a defense against the dark arts teacher with a personality like poisoned honey; a big surprise on the gryffindor quidditch team; and the looming terror of the ordinary wizarding level exams but all these things pale next to the growing threat of hewhomustnotbenamed  a threat that neither the magical government nor the authorities at hogwarts can stopas the grasp of darkness tightens harry must discover the true depth and strength of his friends the importance of boundless loyalty and the shocking price of unbearable sacrificehis fate depends on them all,"fantasy, youngadult, fiction, classics",4.46,1735368,307,J.K. Rowling
19,23,"Harry Potter and the Chamber of Secrets (Harry Potter, #2)",1998,341,ever since harry potter had come home for the summer the dursleys had been so mean and hideous that all harry wanted was to get back to the hogwarts school for witchcraft and wizardry but just as he’s packing his bags harry receives a warning from a strange impish creature who says that if harry returns to hogwarts disaster will strikeand strike it does for in harry’s second year at hogwarts fresh torments and horrors arise including an outrageously stuckup new professor and a spirit who haunts the girls’ bathroom but then the real trouble begins – someone is turning hogwarts students to stone could it be draco malfoy a more poisonous rival than ever? could it possible be hagrid whose mysterious past is finally told? or could it be the one everyone at hogwarts most suspects… harry potter himself!,"fantasy, youngadult, fiction, classics",4.37,1779331,398,J.K. Rowling
20,24,"Harry Potter and the Goblet of Fire (Harry Potter, #4)",2000,734,harry potter is midway through his training as a wizard and his coming of age harry wants to get away from the pernicious dursleys and go to the international quidditch cup with hermione ron and the weasleys he wants to dream about cho chang his crush and maybe do more than dream he wants to find out about the mysterious event thats supposed to take place at hogwarts this year an event involving two other rival schools of magic and a competition that hasnt happened for hundreds of years he wants to be a normal fourteenyearold wizard but unfortunately for harry potter hes not normal  even by wizarding standardsand in his case different can be deadly,"fantasy, youngadult, fiction, classics",4.53,1753043,332,J.K. Rowling
21,25,"Harry Potter and the Deathly Hallows (Harry Potter, #7)",2007,759,harry potter is leaving privet drive for the last time but as he climbs into the sidecar of hagrid’s motorbike and they take to the skies he knows lord voldemort and the death eaters will not be far behindthe protective charm that has kept him safe until now is broken but the dark lord is breathing fear into everything he loves and he knows he can’t keep hidingto stop voldemort harry knows he must find the remaining horcruxes and destroy themhe will have to face his enemy in one final battlejkrowlingcom,"fantasy, youngadult, fiction, classics",4.61,1746574,263,J.K. Rowling
23,27,"Harry Potter and the Half-Blood Prince (Harry Potter, #6)",2005,652,the war against voldemort is not going well; even muggle governments are noticing ron scans the obituary pages of the daily prophet looking for familiar names dumbledore is absent from hogwarts for long stretches of time and the order of the phoenix has already suffered lossesand yet   as in all wars life goes on the weasley twins expand their business sixthyear students learn to apparate  and lose a few eyebrows in the process teenagers flirt and fight and fall in love classes are never straightforward through harry receives some extraordinary help from the mysterious halfblood princeso its the home front that takes center stage in the multilayered sixth installment of the story of harry potter here at hogwarts harry will search for the full and complete story of the boy who became lord voldemort  and thereby find what may be his only vulnerability,"fantasy, youngadult, fiction, classics",4.54,1678823,275,J.K. Rowling
29,33,Memoirs of a Geisha,1997,503,a literary sensation and runaway bestseller this brilliant debut novel presents with seamless authenticity and exquisite lyricism the true confessions of one of japans most celebrated geishain memoirs of a geisha we enter a world where appearances are paramount; where a girls virginity is auctioned to the highest bidder; where women are trained to beguile the most powerful men; and where love is scorned as illusion it is a unique and triumphant work of fiction  at once romantic erotic suspenseful  and completely unforgettable,"fiction, historicalfiction, romance, classics",4.08,1300209,220,Arthur Golden
32,37,"The Lion, the Witch, and the Wardrobe (Chronicles of Narnia, #1)",1950,206,narniathe land beyond the wardrobe door a secret place frozen in eternal winter a magical country waiting to be set freelucy is the first to find the secret of the wardrobe in the professors mysterious old house at first her brothers and sister dont believe her when she tells of her visit to the land of narnia but soon edmund then peter and susan step through the wardrobe themselves in narnia they find a country buried under the evil enchantment of the white witch when they meet the lion aslan they realize theyve been called to a great adventure and bravely join the battle to free narnia from the witchs sinister spell,"fantasy, classics, fiction, youngadult, christian",4.19,1531800,474,C.S. Lewis
37,42,"Little Women (Little Women, #1)",1868,449,generations of readers young and old male and female have fallen in love with the march sisters of louisa may alcott’s most popular and enduring novel little women here are talented tomboy and authortobe jo tragically frail beth beautiful meg and romantic spoiled amy united in their devotion to each other and their struggles to survive in new england during the civil warit is no secret that alcott based little women on her own early life while her father the freethinking reformer and abolitionist bronson alcott hobnobbed with such eminent male authors as emerson thoreau and hawthorne louisa supported herself and her sisters with woman’s work” including sewing doing laundry and acting as a domestic servant but she soon discovered she could make more money writing little women brought her lasting fame and fortune and far from being the girl’s book” her publisher requested it explores such timeless themes as love and death war and peace the conflict between personal ambition and family responsibilities and the clash of cultures between europe and america,"classics, fiction, historicalfiction, youngadult, romance",4.04,1257121,1707,Louisa May Alcott
38,43,Jane Eyre,1847,532,orphaned as a child jane has felt an outcast her whole young life her courage is tested once again when she arrives at thornfield hall where she has been hired by the brooding proud edward rochester to care for his ward adèle jane finds herself drawn to his troubled yet kind spirit she falls in love hard but there is a terrifying secret inside the gloomy forbidding thornfield hall is rochester hiding from jane? will jane be left heartbroken and exiled once again?,"classics, fiction, romance, historicalfiction",4.1,1198557,2568,Charlotte Brontë
41,47,The Book Thief,2005,552,librarians note an alternate cover edition can be found hereit is 1939 nazi germany the country is holding its breath death has never been busier and will be busier stillby her brothers graveside liesels life is changed when she picks up a single object partially hidden in the snow it is the gravediggers handbook left behind there by accident and it is her first act of book thievery so begins a love affair with books and words as liesel with the help of her accordianplaying foster father learns to read soon she is stealing books from nazi bookburnings the mayors wifes library wherever there are books to be foundbut these are dangerous times when liesels foster family hides a jew in their basement liesels world is both opened up and closed downin superbly crafted writing that burns with intensity awardwinning author markus zusak has given us one of the most enduring stories of our timenote this title was not published as ya fiction,"historicalfiction, fiction, youngadult, classics",4.36,1159741,251,Markus Zusak
47,54,"The Hitchhiker's Guide to the Galaxy (Hitchhiker's Guide to the Galaxy, #1)",1979,193,seconds before the earth is demolished to make way for a galactic freeway arthur dent is plucked off the planet by his friend ford prefect a researcher for the revised edition of the hitchhikers guide to the galaxy who for the last fifteen years has been posing as an outofwork actortogether this dynamic pair begin a journey through space aided by quotes from the hitchhikers guide a towel is about the most massively useful thing an interstellar hitchhiker can have and a galaxyfull of fellow travelers zaphod beeblebroxthe twoheaded threearmed exhippie and totally outtolunch president of the galaxy; trillian zaphods girlfriend formally tricia mcmillan whom arthur tried to pick up at a cocktail party once upon a time zone; marvin a paranoid brilliant and chronically depressed robot; veet voojagig a former graduate student who is obsessed with the disappearance of all the ballpoint pens he bought over the years,"sciencefiction, fiction, fantasy, classics",4.2,936782,257,Douglas Adams
58,65,Slaughterhouse-Five,1969,275,selected by the modern library as one of the 100 best novels of all time slaughterhousefive an american classic is one of the worlds great antiwar books centering on the infamous firebombing of dresden billy pilgrims odyssey through time reflects the mythic journey of our own fractured lives as we search for meaning in what we fear most,"classics, fiction, sciencefiction, historicalfiction, fantasy",4.06,846488,241,Kurt Vonnegut Jr.
59,66,Gone with the Wind,1936,1037,scarlett ohara the beautiful spoiled daughter of a welltodo georgia plantation owner must use every means at her disposal to claw her way out of the poverty she finds herself in after shermans march to the sea,"classics, historicalfiction, fiction, romance",4.28,873981,409,Margaret Mitchell
63,70,"Ender's Game (Ender's Saga, #1)",1985,324,andrew ender wiggin thinks he is playing computer simulated war games; he is in fact engaged in something far more desperate the result of genetic experimentation ender may be the military genius earth desperately needs in a war against an alien enemy seeking to destroy all human life the only way to find out is to throw ender into ever harsher training to chip away and find the diamond inside or destroy him utterly ender wiggin is six years old when it begins he will grow up fastbut ender is not the only result of the experiment the war with the buggers has been raging for a hundred years and the quest for the perfect general has been underway almost as long enders two older siblings peter and valentine are every bit as unusual as he is but in very different ways while peter was too uncontrollably violent valentine very nearly lacks the capability for violence altogether neither was found suitable for the militarys purpose but they are driven by their jealousy of ender and by their inbred drive for power peter seeks to control the political process to become a ruler valentines abilities turn more toward the subtle control of the beliefs of commoner and elite alike through powerfully convincing essays hiding their youth and identities behind the anonymity of the computer networks these two begin working together to shape the destiny of earthan earth that has no future at all if their brother ender failssource hatrackcom,"sciencefiction, fiction, youngadult, fantasy, classics",4.3,813439,224,Orson Scott Card
64,72,The Shining (The Shining #1),1977,659,jack torrances new job at the overlook hotel is the perfect chance for a fresh start as the offseason caretaker at the atmospheric old hotel hell have plenty of time to spend reconnecting with his family and working on his writing but as the harsh winter weather sets in the idyllic location feels ever more remoteand more sinister and the only one to notice the strange and terrible forces gathering around the overlook is danny torrance a uniquely gifted fiveyearold,"horror, fiction, thriller, classics, fantasy, mystery, paranormal, suspense",4.17,791850,289,Stephen King
