Unnamed: 0,book_id,title,year,pages,description,genres,average_rating,ratings_count,books_count,authors
208,230,Persuasion,1817,249,twentysevenyear old anne elliot is austens most adult heroine eight years before the story proper begins she is happily betrothed to a naval officer frederick wentworth but she precipitously breaks off the engagement when persuaded by her friend lady russell that such a match is unworthy the breakup produces in anne a deep and longlasting regret when later wentworth returns from sea a rich and successful captain he finds annes family on the brink of financial ruin and his own sister a tenant in kellynch hall the elliot estate all the tension of the novel revolves around one question will anne and wentworth be reunited in their love?jane austen once compared her writing to painting on a little bit of ivory 2 inches square readers of persuasion will discover that neither her skill for delicate ironic observations on social custom love and marriage nor her ability to apply a sharp focus lens to english manners and morals has deserted her in her final finished work,"classics, fiction, romance, historicalfiction",4.13,365425,1451,Jane Austen
223,247,The 7 Habits of Highly Effective People: Powerful Lessons in Personal Change,1989,372,when stephen covey first released the seven habits of highly effective people the book became an instant rage because people suddenly got up and took notice that their lives were headed off in the wrong direction; and more than that they realized that there were so many simple things they could do in order to navigate their life correctly this book was wonderful education for people education in how to live life effectively and get closer to the ideal of being a ‘success’ in lifebut not everyone understands stephen covey’s model fully well or maybe there are some people who haven’t read it yet this is definitely true because we still see so much failure all around us now i am not saying that by using covey’s model or anyone else’s model for that matter you can become a sureshot success but at least we should have seen many more successes around us already judging by the number of copies the book has sold! so where is the shortcoming?there are two main problems here and we are talking only about the people who have read the book already the first problem is that most people are too lazy to implement the ideals of stephen covey in their lives they consider his masterpiece of a book as a mere coffeetable book or a book that you use for light reading when you are traveling and then forget all about it they do not realize that this book contains lifechanging information or they take the information and do not make the effort to actually utilize it so that it becomes knowledge for themthe second problem is that a lot of people have a myopic view of covey’s ideals these are people who are impressed by the book already if you ask them what the seven habits are they can rattle them off end to end but then they miss the larger picture they do not understand that covey was trying to tell more than he wrote in words there are hidden implications in this book yes and a lot of people have just failed to see through themthat is what we are trying to do we are trying to show you how covey’s book or rather his model was a complete model in itself there was nothing amiss about it if you implement it there should be no aspect of your life that should go untouched the only thing is that you have to understand these ideals and try to implement them in your lifebut before we barge into that area it is extremely important to understand what these ideals are what was the model that was propounded by stephen covey in his megafamous book? we shall begin by trying to understand his model first and then interpret it in such a way that it pertains to every aspect of our life,"selfhelp, nonfiction, business, psychology, philosophy",4.05,314700,250,Stephen R. Covey
233,258,"The Shadow of the Wind (The Cemetery of Forgotten Books,  #1)",2001,487,barcelona 1945 a city slowly heals from its war wounds and daniel an antiquarian book dealers son who mourns the loss of his mother finds solace in a mysterious book entitled the shadow of the wind by one julian carax but when he sets out to find the authors other works he makes a shocking discovery someone has been systematically destroying every copy of every book carax has written in fact daniel may have the last of caraxs books in existence soon daniels seemingly innocent quest opens a door into one of barcelonas darkest secretsan epic story of murder madness and doomed loveback cover,"fiction, historicalfiction, mystery, fantasy",4.24,263685,279,Carlos Ruiz Zafón
235,260,How to Win Friends and Influence People,1936,288,isbn  moved to this editionyou can go after the job you wantand get it! you can take the job you haveand improve it! you can take any situation youre inand make it work for you!since its release in 1936 how to win friends and influence people has sold more than 15 million copies dale carnegies first book is a timeless bestseller packed with rocksolid advice that has carried thousands of now famous people up the ladder of success in their business and personal livesas relevant as ever before dale carnegies principles endure and will help you achieve your maximum potential in the complex and competitive modern agelearn the six ways to make people like you the twelve ways to win people to your way of thinking and the nine ways to change people without arousing resentment,"nonfiction, selfhelp, business, psychology, classics",4.13,282623,353,Dale Carnegie
244,270,Rebecca,1938,449,last night i dreamt i went to manderley again   the novel begins in monte carlo where our heroine is swept off her feet by the dashing widower maxim de winter and his sudden proposal of marriage orphaned and working as a ladys maid she can barely believe her luck it is only when they arrive at his massive country estate that she realizes how large a shadow his late wife will cast over their livespresenting her with a lingering evil that threatens to destroy their marriage from beyond the grave,"classics, fiction, mystery, romance, historicalfiction, thriller, suspense",4.2,177384,306,Daphne du Maurier
246,274,The Godfather,1969,448,the godfatherthe epic tale of crime and betrayal that became a global phenomenonalmost fifty years ago a classic was born a searing portrayal of the mafia underworld the godfather introduced readers to the first family of american crime fiction the corleones and their powerful legacy of tradition blood and honor the seduction of power the pitfalls of greed and the allegiance to familythese are the themes that have resonated with millions of readers around the world and made the godfather the definitive novel of the violent subculture that steeped in intrigue and controversy remains indelibly etched in our collective consciousness~penguincom,"fiction, classics, crime, thriller, historicalfiction, mystery",4.36,256480,259,Mario Puzo
264,292,"The Voyage of the Dawn Treader (Chronicles of Narnia, #3)",1951,248,the dawn treader will take you places you never dreamed existed narnia the world of wicked dragons and magic spells where the very best is brought out of even the worst people where anything can happen and most often does and where the adventure beginsthe dawn treader is the first ship narnia has seen in centuries king caspian has built it for his voyage to find the seven lords good men whom his evil uncle miraz banished when he usurped the throne the journey takes edmund lucy and their cousin eustace to the eastern islands beyond the silver sea toward aslans country at the end of the world,"fantasy, fiction, classics, youngadult, christian",4.08,306492,299,C.S. Lewis
282,311,The Thorn Birds,1977,692,alternate cover edition isbn  isbn13 the thorn birds is a robust romantic saga of a singular family the clearys it begins in the early part of this century when paddy cleary moves his wife fiona and their seven children to drogheda the vast australian sheep station owned by his autocratic and childless older sister; and it ends more than half a century later when the only survivor of the third generation the brilliant actress justine oneill sets a course of life and love halfway around the world from her rootsthe central figures in this enthralling story are the indomitable meggie the only cleary daughter and the one man she truly loves the stunningly handsome and ambitious priest ralph de bricassart ralphs course moves him a long way indeed from a remote outback parish to the halls of the vatican; and meggies except for a brief and miserable marriage elsewhere is fixed to the drogheda that is part of her bones  but distance does not dim their feelings though it shapes their liveswonderful characters people this book; strong and gentle paddy hiding a private memory; dutiful fiona holding back love because it once betrayed her violent tormented frank and the other hardworking cleary sons who give the boundless lands of drogheda the energy and devotion most men save for women; meggie; ralph; and meggies children justine and dane and the land itself; stark relentless in its demands brilliant in its flowering prey to gigantic cycles of drought and flood rich when nature is bountiful surreal like no other place on earthfirst edition jacket,"fiction, historicalfiction, romance, classics",4.22,255651,201,Colleen McCullough
294,323,The Unbearable Lightness of Being,1984,320,in the unbearable lightness of being milan kundera tells the story of a young woman in love with a man torn between his love for her and his incorrigible womanizing and one of his mistresses and her humbly faithful lover this magnificent novel juxtaposes geographically distant places brilliant and playful reflections and a variety of styles to take its place as perhaps the major achievement of one of the world’s truly great writers,"fiction, classics, philosophy, romance, contemporary",4.08,205279,274,Milan Kundera
302,332,"The Magician's Nephew (Chronicles of Narnia, #6)",1953,221,the secret passage to the house next door leads to a fascinating adventurenarniawhere the woods are thick and cold where talking beasts are called to lifea new world where the adventure beginsdigory and polly meet and become friends one cold wet summer in london their lives burst into adventure when digorys uncle andrew who thinks he is a magician sends them hurtling tosomewhere else they find their way to narnia newborn from the lions song and encounter the evil sorceress jadis before they finally return home,"fantasy, classics, fiction, youngadult, christian",4.01,268355,312,C.S. Lewis
344,377,Stardust,1999,248,life moves at a leisurely pace in the tiny town of wallnamed after the imposing stone barrier which separates the town from a grassy meadow here young tristran thorn has lost his heart to the beautiful victoria forester and for the coveted prize of her hand tristran vows to retrieve a fallen star and deliver it to his beloved it is an oath that sends him over the ancient wall and into a world that is dangerous and strange beyond imagining,"fantasy, fiction, romance, youngadult",4.07,237602,207,Neil Gaiman
347,380,Norwegian Wood,1987,296,toru a quiet and preternaturally serious young college student in tokyo is devoted to naoko a beautiful and introspective young woman but their mutual passion is marked by the tragic death of their best friend years before toru begins to adapt to campus life and the loneliness and isolation he faces there but naoko finds the pressures and responsibilities of life unbearable as she retreats further into her own world toru finds himself reaching out to others and drawn to a fiercely independent and sexually liberated young womana magnificent blending of the music the mood and the ethos that was the sixties with the story of one college students romantic coming of age norwegian wood brilliantly recaptures a young mans first hopeless and heroic love,"fiction, romance, contemporary",4.02,183988,232,Haruki Murakami
378,413,The Three Musketeers,1844,625,alexandre dumas’s most famous tale and possibly the most famous historical novel of all time in a handsome hardcover volumethis swashbuckling epic of chivalry honor and derringdo set in france during the 1620s is richly populated with romantic heroes unattainable heroines kings queens cavaliers and criminals in a whirl of adventure espionage conspiracy murder vengeance love scandal and suspense dumas transforms minor historical figures into larger thanlife characters the comte d’artagnan an impetuous young man in pursuit of glory; the beguilingly evil seductress “milady”; the powerful and devious cardinal richelieu; the weak king louis xiii and his unhappy queenand of course the three musketeers themselves athos porthos and aramis whose motto “all for one one for all” has come to epitomize devoted friendship with a plot that delivers stolen diamonds masked balls purloined letters and of course great bouts of swordplay the three musketeers is eternally entertaining,"classics, fiction, historicalfiction",4.06,195274,1341,Alexandre Dumas
389,424,The Name of the Rose,1980,536,the year is 1327 benedictines in a wealthy italian abbey are suspected of heresy and brother william of baskerville arrives to investigate when his delicate mission is suddenly overshadowed by seven bizarre deaths brother william turns detective his tools are the logic of aristotle the theology of aquinas the empirical insights of roger baconall sharpened to a glistening edge by wry humor and a ferocious curiosity he collects evidence deciphers secret symbols and coded manuscripts and digs into the eerie labyrinth of the abbey where “the most interesting things happen at night”,"fiction, historicalfiction, mystery, classics, crime",4.11,200217,428,Umberto Eco
392,427,The Importance of Being Earnest,1895,76,oscar wildes madcap farce about mistaken identities secret engagements and lovers entanglements still delights readers more than a century after its 1895 publication and premiere performance the rapidfire wit and eccentric characters of the importance of being earnest have made it a mainstay of the high school curriculum for decadescecily cardew and gwendolen fairfax are both in love with the same mythical suitor jack worthing has wooed gwendolen as ernest while algernon has also posed as ernest to win the heart of jacks ward cecily when all four arrive at jacks country home on the same weekend the rivals to fight for ernests undivided attention and the ernests to claim their beloveds pandemonium breaks loose only a senile nursemaid and an old discarded handbag can save the day!this prestwick house literary touchstone edition includes a glossary and readers notes to help the modern reader appreciate wildes wry wit and elaborate plot twists,"classics, fiction, romance",4.17,210630,728,Oscar Wilde
397,432,"I, Robot (Robot #0.1)",1950,224,isaac asimovs i robot launches readers on an adventure into a notsodistant future where man and machine  struggle to redefinelife love and consciousnessand where the stakes are nothing less than survival filled with unforgettable characters mindbending speculation and nonstop action i robot is a powerful reading experience from one of the master storytellers of our time i robot they mustnt harm a human being they must obey hitman orders and they must protect their own existencebut only so long as that doesnt violate rules one and two with these three laws of robotics humanity embarked on perhaps its greatest adventure the invention of the first positronic man it was a bold new era of evolution that would open up enormous possibilitiesand unforeseen risks for the scientists who invented the earliest robots werent content that their creations should  remain programmed helpers companions and semisentient workermachines and soon the robots themselves; aware of their own intelligence power and humanity arent either as humans and robots struggle to survive togetherand sometimes against each otheron earth and in space the future of both hangs in the balance human men and women confront robots gone mad telepathic robots robot politicians and vast robotic intelligences that may already secretly control the world and both are asking the same questions what is human? and is humanity obsolete? in l robot isaac asimov changes forever our perception of robots and human beings and updates the timeless myth of mans dream to play god with all its rewardsand terrorsfront flap,"sciencefiction, fiction, classics, fantasy",4.17,198368,218,Isaac Asimov
404,439,A Brief History of Time,1987,212,in the ten years since its publication in 1988 stephen hawkings classic work has become a landmark volume in scientific writing with more than nine million copies in forty languages sold worldwide that edition was on the cutting edge of what was then known about the origins and nature of the universe but the intervening years have seen extraordinary advances in the technology of observing both the micro and the macrocosmic worlds these observations have confirmed many of professor hawkings theoretical predictions in the first edition of his book including the recent discoveries of the cosmic background explorer satellite cobe which probed back in time to within 300000 years of the universes beginning and revealed wrinkles in the fabric of spacetime that he had projected eager to bring to his original text the new knowledge revealed by these observations as well as his own recent research professor hawking has prepared a new introduction to the book written an entirely new chapter on wormholes and time travel and updated the chapters throughout,"science, nonfiction, history, philosophy, classics",4.12,165628,246,Stephen Hawking
408,444,"Winnie-the-Pooh (Winnie-the-Pooh, #1)",1926,145,the adventures of christopher robin and his friends in which pooh bear uses a balloon to get honey piglet meets a heffalump and eeyore has a birthday,"classics, fiction, fantasy, youngadult",4.34,207550,244,A.A. Milne
410,446,A Study in Scarlet,1887,123,a study in scarlet is the first published story of one of the most famous literary detectives of all time sherlock holmes here dr watson who has just returned from a war in afghanistan meets sherlock holmes for the first time when they become flatmates at the famous 221 b baker street in a study in scarlet sherlock holmes investigates a murder at lauriston gardens as dr watson tags along with holmes while narratively detailing his amazing deductive abilities,"classics, mystery, fiction, crime, historicalfiction",4.15,201499,1106,Arthur Conan Doyle
427,464,Holy Bible: King James Version,1611,1590,holy bible king james version,"religion, classics, nonfiction, christian, history, philosophy, spirituality",4.43,159457,1449,Anonymous
447,485,The Brothers Karamazov,1880,796,the brothers karamazov is a murder mystery a courtroom drama and an exploration of erotic rivalry in a series of triangular love affairs involving the “wicked and sentimental” fyodor pavlovich karamazov and his three sons―the impulsive and sensual dmitri; the coldly rational ivan; and the healthy redcheeked young novice alyosha through the gripping events of their story dostoevsky portrays the whole of russian life is social and spiritual striving in what was both the golden age and a tragic turning point in russian culturethis awardwinning translation by richard pevear and larissa volokhonsky remains true to the verbalinventiveness of dostoevsky’s prose preserving the multiple voices the humor and the surprising modernity of the original it is an achievement worthy of dostoevsky’s last and greatest novel,"classics, fiction, philosophy, religion",4.3,155838,1072,Fyodor Dostoyevsky
451,489,The Prophet,1923,127,kahlil gibran’s masterpiece the prophet is one of the most beloved classics of our time published in 1923 it has been translated into more than twenty languages and the american editions alone have sold more than nine million copiesthe prophet is a collection of poetic essays that are philosophical spiritual and above all inspirational gibran’s musings are divided into twentyeight chapters covering such sprawling topics as love marriage children giving eating and drinking work joy and sorrow housing clothes buying and selling crime and punishment laws freedom reason and passion pain selfknowledge teaching friendship talking time good and evil prayer pleasure beauty religion and death,"poetry, philosophy, classics, fiction, spirituality, religion, selfhelp",4.22,142641,721,Kahlil Gibran
457,498,War and Peace,1869,1392,in russias struggle with napoleon tolstoy saw a tragedy that involved all mankind greater than a historical chronicle war and peace is an affirmation of life itself `a complete picture as a contemporary reviewer put it `of everything in which people find their happiness and greatness their grief and humiliation tolstoy gave his personal approval to this translation published here in a new single volume edition which includes an introduction by henry gifford and tolstoys important essay `some words about war and peace,"classics, fiction, historicalfiction",4.11,168037,1017,Leo Tolstoy
462,503,"2001: A Space Odyssey (Space Odyssey, #1)",1968,297,on the moon an enigma is uncovered  so great are the implications of this discovery that for the first time men are sent out deep into our solar system  but long before their destination is reached things begin to go horribly inexplicably wrong  one of the greatestselling science fiction novels of our time this classic book will grip you to the very end,"sciencefiction, fiction, classics, fantasy",4.12,170841,221,Arthur C. Clarke
473,514,The Adventures of Sherlock Holmes,1892,389,the adventures of sherlock holmes is the series of short stories that made the fortunes of the strand magazine in which they were first published and won immense popularity for sherlock holmes and dr watson the detective is at the height of his powers and the volume is full of famous cases including the redheaded league the blue carbuncle and the speckled band although holmes gained a reputation for infallibility conan doyle showed his own realism and feminism by having the great detective defeated by irene adler  the woman  in the very first story a scandal in bohemia the editor of this volume richard lancelyn green is editor of the uncollected sherlock holmes and the further adventures of sherlock holmes with john michael gibson he compiled the soho series bibliography of a conan doyle,"classics, mystery, fiction, crime",4.29,139816,1235,Arthur Conan Doyle
477,518,Peter Pan,1904,176,peter pan by j m barrie peter pan the mischievous boy who refuses to grow up lands in the darlings proper middleclass home to look for his shadow he befriends wendy john and michael and teaches them to fly with a little help from fairy dust he and tinker bell whisk them off to neverland where they encounter the red indians the little lost boys pirates and the dastardly captain hook,"classics, fantasy, fiction, youngadult",4.1,169306,1416,J.M. Barrie
488,530,Much Ado About Nothing,1598,246,in much ado about nothing shakespeare includes two quite different stories of romantic love hero and claudio fall in love almost at first sight but an outsider don john strikes out at their happiness beatrice and benedick are kept apart by pride and mutual antagonism until others decide to play cupid,"classics, fiction, romance",4.06,175616,805,William Shakespeare
502,545,The Velveteen Rabbit,1922,40,nursery magic is very strange and wonderful and only those playthings that are old and wise and experienced like the skin horse understand all about itlike the skin horse margery williams understood how toysand peoplebecome real through the wisdom and experience of love this reissue of a favorite classic with the original story and illustrations as they first appeared in 1922 will work its magic for all who read it,"classics, fiction, fantasy, youngadult",4.29,173469,383,Margery Williams Bianco
548,592,The Master and Margarita,1967,335,the first complete annotated english translation of mikhail bulgakovs comic masterpiecean audacious revision of the stories of faust and pontius pilate the master and margarita is recognized as one of the essential classics of modern russian literature the novels vision of soviet life in the 1930s is so ferociously accurate that it could not be published during its authors lifetime and appeared only in a censored edition in the 1960s its truths are so enduring that its language has become part of the common russian speechone hot spring the devil arrives in moscow accompanied by a retinue that includes a beautiful naked witch and an immense talking black cat with a fondness for chess and vodka the visitors quickly wreak havoc in a city that refuses to believe in either god or satan but they also bring peace to two unhappy muscovites one is the master a writer pilloried for daring to write a novel about christ and pontius pilate; the other is margarita who loves the master so deeply that she is willing literally to go to hell for him what ensues is a novel of inexhaustible energy humor and philosophical depth a work whose nuances emerge for the first time in diana burgins and katherine tiernan oconnors splendid english versionback cover,"classics, fiction, fantasy, historicalfiction",4.32,131389,586,Mikhail Bulgakov
