Unnamed: 0,book_id,title,year,pages,description,genres,average_rating,ratings_count,books_count,authors
2810,3020,The Metamorphosis and Other Stories,1915,224,the metamorphosis and other stories by franz kafka is part of the barnes & noble classics series which offers quality editions at affordable prices to the student and the general reader including new scholarship thoughtful design and pages of carefully crafted extras here are some of the remarkable features of barnes & noble classicsall editions are beautifully designed and are printed to superior specifications; some include illustrations of historical interest barnes & noble classics pulls together a constellation of influencesbiographical historical and literaryto enrich each readers understanding of these enduring worksvirtually unknown during his lifetime franz kafka is now one of the world’s most widely read and discussed authors his nightmarish novels and short stories have come to symbolize modern man’s anxiety and alienation in a bizarre hostile and dehumanized world this vision is most fully realized in kafka’s masterpiece “the metamorphosis” a story that is both harrowing and amusing and a landmark of modern literature bringing together some of kafka’s finest work this collection demonstrates the richness and variety of the author’s artistry “the judgment” which kafka considered to be his decisive breakthrough and “the stoker” which became the first chapter of his novel amerika are here included these two along with “the metamorphosis” form a suite of stories kafka referred to as “the sons” and they collectively present a devastating portrait of the modern familyalso included are “in the penal colony” a story of a torture machine and its operators and victims and “a hunger artist” about the absurdity of an artist trying to communicate with a misunderstanding public kafka’s lucid succinct writing chronicles the labyrinthine complexities the futilityladen horror and the stifling oppressiveness that permeate his vision of modern lifejason baker is a writer of short stories living in brooklyn new york,"classics, fiction, fantasy, philosophy, horror",4.01,29817,205,Franz Kafka
2866,3085,Narcissus and Goldmund,1930,320,narcissus and goldmund tells the story of two medieval men whose characters are diametrically opposite narcissus an ascetic monk firm in his religious commitment and goldmund a romantic youth hungry for knowledge and worldly experience first published in 1930 hesses novel remains a moving and pointed exploration of the conflict between the life of the spirit and the life of the flesh it is a theme that transcends all time,"philosophy, classics, historicalfiction, fiction, spirituality",4.19,25544,214,Hermann Hesse
2917,3139,A Hero of Our Time,1840,185,in its adventurous happenings its abductions duels and sexual intrigues a hero of our time looks backward to the tales of sir walter scott and lord byron so beloved by russian society in the 1820s and 30s in the character of its protagonist pechorin the archetypal russian antihero lermontovs novel looks forward to the subsequent glories and passion of russian literature that it helped in great measure to make possible,"classics, fiction, historicalfiction",4.11,29747,317,Mikhail Lermontov
3020,3252,The Adventures of Tom Sawyer & Adventures of Huckleberry Finn,1876,520,the adventures of tom sawyertake a lighthearted nostalgic trip to a simpler time seen through the eyes of a very special boy named tom sawyer it is a dreamlike summertime world of hooky and adventure pranks and punishment villains and first love filled with memorable characters adults and young readers alike continue to enjoy this delightful classic of the promise and dreams of youth from one of america’s most beloved authors adventures of huckleberry finnhe has no mother his father is a brutal drunkard and he sleeps in a barrel he’s huck finnliar sometime thief and rebel against respectability but when huck meets a runaway slave named jim his life changes forever on their exciting flight down the mississippi aboard a raft the boy nobody wanted matures into a young man of courage and conviction as ernest hemingway said of this glorious novel “all modern american literature comes from one book by mark twain called huckleberry finn”back cover,"classics, fiction, youngadult, historicalfiction",4.07,30228,202,Mark Twain
3067,3306,Just So Stories,1902,210,librarians note alternate cover edition can be found heretwelve stories about animals insects and other subjects include how the camel got his hump the butterfly that stamped and how the alphabet was made,"classics, fiction, fantasy, youngadult",4.09,35708,598,Rudyard Kipling
3103,3346,Wives and Daughters,1866,679,set in english society before the 1832 reform bill wives and daughters centres on the story of youthful molly gibson brought up from childhood by her father when he remarries a new stepsister enters mollys quiet life – loveable but worldly and troubling cynthia the narrative traces the development of the two girls into womanhood within the gossiping and watchful society of hollingfordwives and daughters is far more than a nostalgic evocation of village life; it offers an ironic critique of midvictorian society no nineteenthcentury novel contains a more devastating rejection than this of the victorian male assumption of moral authority writes pam morris in her introduction to this new edition in which she explores the novels main themes – the role of women darwinism and the concept of englishness – and its literary and social context,"classics, fiction, romance, historicalfiction",4.07,32029,253,Elizabeth Gaskell
3108,3351,"The Mysterious Island (Extraordinary Voyages, #12)",1874,723,after hijacking a balloon from a confederate camp a band of five northern prisoners escapes the american civil war seven thousand miles later they drop from the clouds onto an uncharted volcanic island in the pacific through teamwork scientific knowledge engineering and perseverance they endeavour to build a colony from scratch but this island of abundant resources has its secrets the castaways discover they are not alone a shadowy yet familiar agent of their unfathomable fate is watchingwhat unfolds in jules verne’s imaginative marvel is both an enthralling mystery and the ultimate in survivalist adventures,"classics, fiction, sciencefiction, fantasy",4.08,26440,661,Jules Verne
3152,3398,The Ugly Duckling,1843,40,for over one hundred years the ugly duckling has been a childhood favorite and jerry pinkneys spectacular new adaptation brings it triumphantly to new generations of readers with keen emotion and fresh vision the acclaimed artist captures the essence of the tales timeless appeal the journey of the awkward little bird  marching bravely through hecklers hunters and cruel seasons  is an unforgettable survival story; this blooming into a graceful swan is a reminder of the patience often necessary to discover true happiness splendid watercolors set in the lush countryside bring drama to life,"classics, fiction, fantasy",4.1,25306,232,Hans Christian Andersen
3171,3419,Incidents in the Life of a Slave Girl,1861,176,the true story of an individuals struggle for selfidentity selfpreservation and freedom incidents in the life of a slave girl remains among the few extant slave narratives written by a woman this autobiographical account chronicles the remarkable odyssey of harriet jacobs 1813–1897 whose dauntless spirit and faith carried her from a life of servitude and degradation in north carolina to liberty and reunion with her children in the northwritten and published in 1861 after jacobs harrowing escape from a vile and predatory master the memoir delivers a powerful and unflinching portrayal of the abuses and hypocrisy of the masterslave relationship jacobs writes frankly of the horrors she suffered as a slave her eventual escape after several unsuccessful attempts and her seven years in selfimposed exile hiding in a coffinlike garret attached to her grandmothers porcha rare firsthand account of a courageous womans determination and endurance this inspirational story also represents a valuable historical record of the continuing battle for freedom and the preservation of family,"nonfiction, history, classics, memoir, biography",4.08,24744,341,Harriet Jacobs
3200,3451,Letters to a Young Poet,1929,80,in 1903 a student at a military academy sent some of his verses to a wellknown austrian poet requesting an assessment of their value the older artist rainer maria rilke 1875–1926 replied to the novice in this series of letters  an amazing archive of remarkable insights into the ideas behind rilkes greatest poetry the ten letters reproduced here were written during an important stage in rilkes artistic development and they contain many of the themes that later appeared in his best works the poet himself afterwards stated that his letters contained part of his creative genius making this volume essential reading for scholars poetry lovers and anyone with an interest in rilke german poetry or the creative impulse,"poetry, nonfiction, classics, philosophy, art, memoir",4.34,25066,220,Rainer Maria Rilke
3206,3457,Les Fleurs du Mal,1857,365,presents the first american translation of the complete text of baudelaires 1857 masterwork and includes the complete original french texts for easy comparison,"poetry, classics, fiction",4.26,27124,667,Charles Baudelaire
3250,3508,"Swann's Way (In Search of Lost Time, #1)",1913,444,marcel prousts in search of lost time is one of the most entertaining reading experiences in any language and arguably the finest novel of the twentieth century but since its original prewar translation there has been no completely new version in english now penguin brings prousts masterpiece to new audiences throughout the world beginning with lydia daviss internationally acclaimed translation of the first volume swanns wayswanns way is one of the preeminent novels of childhood a sensitive boys impressions of his family and neighbors all brought dazzlingly back to life years later by the taste of a madeleine it also enfolds the short novel swann in love an incomparable study of sexual jealousy that becomes a crucial part of the vast unfolding structure of in search of lost time the first volume of the work that established proust as one of the finest voices of the modern age  satirical skeptical confiding and endlessly varied in its response to the human condition  swanns way also stands on its own as a perfect rendering of a life in art of the past recreated through memory,"classics, fiction, philosophy",4.14,24595,749,Marcel Proust
3328,3594,The Return of Sherlock Holmes,1905,455,holmes i cried is it really you? can it indeed be that you are alive? is it possible that you succeeded in climbing out of that awful abyss?missing presumed dead for three years sherlock holmes returns triumphantly to his dear companion dr watson and not before time! london has never been in more need of his extraordinary services a murderous individual with an air gun stalks the cityamong thirteen further brilliant tales of mystery detection and deduction sherlock holmes investigates the problem of the norwood builder deciphers the message of the dancing men and cracks the case of the six napoleons,"mystery, classics, fiction, crime, historicalfiction",4.3,31572,680,Arthur Conan Doyle
3405,3689,The Practice of the Presence of God,1691,96,brother lawrence was a man of humble beginnings who discovered the greatest secret of living in the kingdom of god here on earth it is the art of “practicing the presence of god in one single act that does not end” he often stated that it is god who paints himself in the depths of our souls we must merely open our hearts to receive him and his loving presence as a humble cook brother lawrence learned an important lesson through each daily chore the time he spent in communion with the lord should be the same whether he was bustling around in the kitchenwith several people asking questions at the same timeor on his knees in prayer he learned to cultivate the deep presence of god so thoroughly in his own heart that he was able to joyfully exclaim “i am doing now what i will do for all eternity i am blessing god praising him adoring him and loving him with all my heart” this unparalleled classic has given both blessing and instruction to those who can be content with nothing less than knowing god in all his majesty and feeling his loving presence throughout each simple day,"christian, nonfiction, spirituality, religion, classics",4.32,23889,233,Brother Lawrence
3414,3699,An Ideal Husband,1893,78,although oscar wilde 1854–1900 created a wide range of poetry essays and fairy tales and one novel in his brief tragic life he is perhaps best known as a dramatist his witty clever drama populated by brilliant talkers skilled in the art of riposte and paradox are still staples of the theatrical repertoirean ideal husband revolves around a blackmail scheme that forces a married couple to reexamine their moral standards  providing along the way a wry commentary on the rarity of politicians who can claim to be ethically pure a supporting cast of young lovers society matrons an overbearing father and a formidable femme fatale continually exchange sparkling repartee keeping the play moving at a lively pacelike most of wildes plays this scintillating drawingroom comedy is wise wellconstructed and deeply satisfying an instant success at its 1895 debut the play continues to delight audiences over one hundred years later an ideal husband is a mustread for wilde fans students of english literature and anyone delighted by wit urbanity and timeless sophistication,"classics, fiction, romance",4.03,29952,347,Oscar Wilde
3433,3720,The Federalist Papers,1787,688,hailed by thomas jefferson as “the best commentary on the principles of government which was ever written the federalist papers is a collection of eightyfive essays published by founding fathers alexander hamilton james madison and john jay from 1787 to 1788 as a means to persuade the public to ratify the constitution of the united states      with nearly twothirds of the essays written by hamilton this enduring classic is perfect for modern audiences passionate about his work or seeking a deeper understanding of one of the most important documents in us history ,"history, nonfiction, classics, philosophy",4.05,24648,424,Alexander Hamilton
3558,3868,The Symposium,-385,131,a fascinating discussion on sex gender and human instincts as relevant today as everin the course of a lively drinking party a group of athenian intellectuals exchange views on eros or desire from their conversation emerges a series of subtle reflections on gender roles sex in society and the sublimation of basic human instincts the discussion culminates in a radical challenge to conventional views by platos mentor socrates who advocates transcendence through spiritual love the symposium is a deft interweaving of different viewpoints and ideas about the nature of loveas a response to beauty a cosmic force a motive for social action and as a means of ethical educationfor more than seventy years penguin has been the leading publisher of classic literature in the englishspeaking world with more than 1700 titles penguin classics represents a global bookshelf of the best works throughout history and across genres and disciplines readers trust the series to provide authoritative texts enhanced by introductions and notes by distinguished scholars and contemporary authors as well as uptodate translations by awardwinning translators,"philosophy, classics, nonfiction, history",4.01,22413,458,Plato
3669,4003,Ben-Hur: A Tale of the Christ,1880,620,benhur a tale of the christ 1880 by lew wallace is one of the most popular and beloved 19th century american novels this faithful new testament tale combines the events of the life of jesus with grand historical spectacle in the exciting story of judah of the house of hur a man who finds extraordinary redemption for himself and his familya classic of faith fortitude and inspiration,"classics, historicalfiction, fiction, christian, religion",4.02,25280,612,Lew Wallace
3725,4068,"Daddy-Long-Legs (Daddy-Long-Legs, #1)",1912,249,when jerusha abbott an eighteenyearold girl living in an orphan asylum was told that a mysterious millionaire had agreed to pay for her education it was like a dream come true for the first time in her life she had someone she could pretend was family but everything was not perfect for he chose to remain anonymous and asked that she only write him concerning her progress in school who was this mysterious gentleman and would jerusha ever meet him?,"classics, fiction, youngadult, romance, historicalfiction",4.09,20889,352,Jean Webster
3757,4104,Demons,1872,733,alternate cover edition isbn  isbn13 inspired by the true story of a political murder that horrified russians in 1869 fyodor dostoevsky conceived of demons as a novelpamphlet in which he would say everything about the plague of materialist ideology that he saw infecting his native land what emerged was a prophetic and ferociously funny masterpiece of ideology and murder in prerevolutionary russia,"classics, fiction, philosophy",4.26,20615,455,Fyodor Dostoyevsky
3759,4106,Notes from Underground,1864,136,dostoevsky’s most revolutionary novel notes from underground marks the dividing line between nineteenth and twentiethcentury fiction and between the visions of self each century embodied one of the most remarkable characters in literature the unnamed narrator is a former official who has defiantly withdrawn into an underground existence in complete retreat from society he scrawls a passionate obsessive selfcontradictory narrative that serves as a devastating attack on social utopianism and an assertion of man’s essentially irrational naturerichard pevear and larissa volokhonsky whose dostoevsky translations have become the standard give us a brilliantly faithful edition of this classic novel conveying all the tragedy and tormented comedy of the original,"classics, fiction, philosophy, psychology",4.15,15297,691,Fyodor Dostoyevsky
3844,4205,Chess Story,1941,104,czentowic champion déchecs arrogant esprit borné à outrance inculte et étonnamment stupide occupe le premier plan jusquà lentrée en scène de monsieur b dès lors que cet aristocrate autrichien sintéresse à la partie livrée entre le champion et les passagers amateurs la direction du texte basculepar un effet de symétrie la narration se transforme en un face à face tendu entre un esprit brillant et rapide à lintelligence abstraite et un cerveau au pragmatisme brutal incapable de projection véritable mise en scène percutante de la résurrection de la folie cette nouvelle oscille entre ouverture et enfermement,"fiction, classics, historicalfiction",4.28,16716,287,Stefan Zweig
3857,4222,"My Man Jeeves (Jeeves, #1)",1919,256,who can forget our beloved gentlemans personal gentleman jeeves who ever comes to the rescue when the hapless bertie wooster falls into trouble my man jeeves is sure to please anyone with a taste for pithy buffoonery moronic misunderstandings gaffes and aristocratic slapstickcontentsleave it to jeevesjeeves and the unbidden guest jeeves and the hardboiled egg absent treatmenthelping freddierallying round old georgedoing clarence a bit of goodthe aunt and the sluggard,"fiction, classics, historicalfiction",4.13,23020,263,P.G. Wodehouse
3889,4262,The Science of Getting Rich,1910,146,as featured in the bestselling book the secret here is the landmark guide to wealth creation republished with the classic essay “how to get what you want” wallace d wattles spent a lifetime considering the laws of success as he found them in the work of the world’s great philosophers he then turned his life effort into this simple slender book – a volume that he vowed could replace libraries of philosophy spirituality and selfhelp for the purpose of attaining one definite goal a life of prosperity wattles describes a definite science of wealth attraction built on the foundation of one commanding idea “there is a thinking stuff from which all things are madeâ€¦a thought in this substance produces the thing that is imaged by the thought” in his seventeen short straighttothepoint chapters wattles shows how to use this idea how to overcome barriers to its application and how work with very direct methods that awaken it in your life he further explains how creation and not competition is the hidden key to wealth attraction and how your power to get rich uplifts everyone around you the science of getting rich concludes with wattle’s rare essay “how to get want you want” – a brilliant refresher of his laws of wealth creation ,"selfhelp, business, nonfiction, psychology, philosophy",4.18,19433,369,Wallace D. Wattles
3963,4348,The Magic Mountain,1924,706,in this dizzyingly rich novel of ideas mann uses a sanatorium in the swiss alps a community devoted exclusively to sickness as a microcosm for europe which in the years before 1914 was already exhibiting the first symptoms of its own terminal irrationality the magic mountain is a monumental work of erudition and irony sexual tension and intellectual ferment a book that pulses with life in the midst of death,"fiction, classics, philosophy",4.14,21078,211,Thomas Mann
4161,4597,The Souls of Black Folk,1903,288,this landmark book is a founding work in the literature of black protest w e b du bois 1868–1963 played a key role in developing the strategy and program that dominated early 20thcentury black protest in america in this collection of essays first published together in 1903 he eloquently affirms that it is beneath the dignity of a human being to beg for those rights that belong inherently to all mankind he also charges that the strategy of accommodation to white supremacy advanced by booker t washington then the most influential black leader in america would only serve to perpetuate black oppressionpublication of the souls of black folk was a dramatic event that helped to polarize black leaders into two groups the more conservative followers of washington and the more radical supporters of aggressive protest its influence cannot be overstated it is essential reading for everyone interested in africanamerican history and the struggle for civil rights in america,"nonfiction, history, classics, philosophy",4.24,20355,387,W.E.B. Du Bois
4199,4645,"Eight Cousins (Eight Cousins, #1)",1874,224,when rose campbell a shy orphan arrives at the aunt hill to live with her six aunts and seven boisterous male cousins she is quite overwhelmed how could such a delicate young lady used to the quiet hallways of a girls boarding school exist in such a spirited home? it is the arrival of uncle alec that changes everything much to the horror of her aunts roses forwardthinking uncle insists that the child get out of the parlor and into the sunshine and with a little courage and lots of adventures with her mischievous but loving cousins rose begins to bloomwritten by the beloved author of little women eight cousins is a masterpiece of childrens literature this endearing novel offers readers of all ages an inspiring story about growing up making friends and facing life with strength and kindness,"classics, fiction, youngadult, historicalfiction",4.02,27612,292,Louisa May Alcott
4244,4698,"Rilla of Ingleside (Anne of Green Gables, #8)",1921,277,annes children are almost grown up except for pretty highspirited rilla no one can resist her bright hazel eyes and dazzling smile rilla almost fifteen cant think any further ahead than going to her very first dance at the four winds lighthouse and getting her first kiss from handsome kenneth ford but undreamedof challenges await the irrepressible rilla when the world of ingleside is endangered by a faroff war her brothers go off to fight and rilla brings home an orphaned newborn in a soup tureen she is swept into a drama that tests her courage and changes her forever,"classics, fiction, youngadult, historicalfiction, romance",4.16,29277,282,L.M. Montgomery
4310,4778,The Holy Bible: English Standard Version,2001,1328,the english standard version esv bible is an essentially literal bible translation that combines wordforword precision and accuracy with literary excellence beauty and depth of meaningthe esv bible is equipped with an enhanced navigation feature kindles index feature can be used to navigate directly to any verse this feature is not supported on the kindle 1 or any kindle applications,"christian, religion, nonfiction, classics, spirituality, history",4.66,17863,627,Anonymous
4381,4866,White Nights,1848,82,white nights is a short story by fyodor dostoevsky that was published in 1848 set in st petersburg this is the story of a young man fighting his inner restlessness a light and tender narrative it delves into the torment and guilt of unrequited love both protagonists suffer from a deep sense of alienation that initially brings them together a blend of romanticism and realism the story appeals gently to the senses and feelings,"classics, fiction, romance",4.05,13405,267,Fyodor Dostoyevsky
